{
  "$schema": "contracts/engineering/task_capsule.schema.json",
  "capsule_id": "CAP-VF-61D",
  "capsule_revision": 1,
  "task_id": "VF-61D",
  "title": "给声音绑定加具名说话人 scope",
  "assigned_role": "AGT-DATA",
  "status": "CREATED",
  "created_at": "2026-09-30T19:32:13.675711+00:00",
  "risk_class": "high",
  "base": {
    "target_ref": "origin/main",
    "base_sha": "0d0a738ace5333438d43604a0b160152deaae83b",
    "target_sha": "68b79c0b61e6f2044229d8d41ee291cfabb42373",
    "context_snapshot": "sha256:65e1bfe17867452850f6bf605374fd2cf1aed6ef80daacd2186fbad19be4ba44"
  },
  "scope": {
    "read": [
      "engine/infrastructure/",
      "engine/tests/",
      "contracts/",
      "docs/03_工程规范/"
    ],
    "write": [
      "engine/infrastructure/",
      "engine/tests/"
    ],
    "forbidden": [
      "macos-app/**",
      "engine/domain/**",
      "engine/ai/**",
      "engine/infrastructure/story_runtime.py",
      "engine/infrastructure/episode_settlement.py",
      "engine/infrastructure/scenarios/",
      "engine/infrastructure/audio/",
      ".hacf/**",
      ".github/**"
    ],
    "privileged_grants": []
  },
  "context": {
    "core_manifest": [
      "symbol:ProbeHttpResponse@engine/infrastructure/audio/capabilities.py:45",
      "symbol:VoiceCapabilityObservation@engine/infrastructure/audio/capabilities.py:54",
      "symbol:RealtimeResponsibilityObservation@engine/infrastructure/audio/capabilities.py:90",
      "symbol:AudioCapabilityObservation@engine/infrastructure/audio/capabilities.py:115",
      "symbol:_NoRedirect@engine/infrastructure/audio/capabilities.py:153",
      "symbol:CapabilityTransportError@engine/infrastructure/audio/capabilities.py:161",
      "symbol:_decode_json@engine/infrastructure/audio/capabilities.py:165",
      "symbol:_sync_get_json@engine/infrastructure/audio/capabilities.py:174",
      "symbol:_default_fetch_json@engine/infrastructure/audio/capabilities.py:218",
      "symbol:_speechrail_capabilities_url@engine/infrastructure/audio/capabilities.py:226",
      "symbol:_bool_or_none@engine/infrastructure/audio/capabilities.py:249",
      "symbol:_str_or_none@engine/infrastructure/audio/capabilities.py:253",
      "symbol:_parameter_supported@engine/infrastructure/audio/capabilities.py:257",
      "symbol:_parameter_supported_in@engine/infrastructure/audio/capabilities.py:261",
      "symbol:_operation_declared@engine/infrastructure/audio/capabilities.py:285",
      "symbol:_parse_model_identity@engine/infrastructure/audio/capabilities.py:293",
      "symbol:_parse_quality_status@engine/infrastructure/audio/capabilities.py:313",
      "symbol:_parse_model_ids@engine/infrastructure/audio/capabilities.py:319",
      "symbol:_parse_voices@engine/infrastructure/audio/capabilities.py:332",
      "symbol:_parse_realtime@engine/infrastructure/audio/capabilities.py:373",
      "symbol:_invalid_snapshot@engine/infrastructure/audio/capabilities.py:386",
      "symbol:_parse_snapshot@engine/infrastructure/audio/capabilities.py:395",
      "symbol:probe_audio_capabilities@engine/infrastructure/audio/capabilities.py:435",
      "symbol:conditional_pin@engine/infrastructure/audio/capabilities.py:82",
      "symbol:caller_orchestrated@engine/infrastructure/audio/capabilities.py:105",
      "symbol:redirect_request@engine/infrastructure/audio/capabilities.py:156",
      "symbol:AudioProviderConfig@engine/infrastructure/audio/config.py:15",
      "symbol:from_env@engine/infrastructure/audio/config.py:27",
      "symbol:DeliveryCursorGetRequest@engine/infrastructure/audio/delivery_control.py:24",
      "symbol:DeliveryCursorUpdateRequest@engine/infrastructure/audio/delivery_control.py:33"
    ],
    "related_contracts": [
      "world_snapshot.schema.json",
      "state_delta.schema.json",
      "domain_event.schema.json"
    ],
    "slice_strategy": "focus-unmatched(static-scope-order)",
    "token_estimate": 783,
    "max_core_tokens": 3000,
    "expansion_policy": "arbiter_approved",
    "note": "上下文为最小充分集而非最小集：不足时可申请扩权/扩上下文并生成胶囊修订版。"
  },
  "impact": {
    "symbols": [
      "ProbeHttpResponse",
      "VoiceCapabilityObservation",
      "RealtimeResponsibilityObservation",
      "AudioCapabilityObservation",
      "_NoRedirect",
      "CapabilityTransportError",
      "_decode_json",
      "_sync_get_json",
      "_default_fetch_json",
      "_speechrail_capabilities_url",
      "_bool_or_none",
      "_str_or_none",
      "_parameter_supported",
      "_parameter_supported_in",
      "_operation_declared",
      "_parse_model_identity",
      "_parse_quality_status",
      "_parse_model_ids",
      "_parse_voices",
      "_parse_realtime",
      "_invalid_snapshot",
      "_parse_snapshot",
      "probe_audio_capabilities",
      "conditional_pin",
      "caller_orchestrated",
      "redirect_request",
      "AudioProviderConfig",
      "from_env",
      "DeliveryCursorGetRequest",
      "DeliveryCursorUpdateRequest"
    ],
    "contracts": [
      "world_snapshot.schema.json",
      "state_delta.schema.json",
      "domain_event.schema.json"
    ],
    "tests": []
  },
  "dependencies": {
    "depends_on": [],
    "conflicts_with": []
  },
  "gates": {
    "profile": "DATA_KERNEL_P0",
    "profile_digest": "sha256:e940897cd69faa57946a4f983a9b4029ee72602a918a61d63a9c6df32688c39c",
    "profile_file": ".hacf/gates/data_kernel_p0.json",
    "risk_class": "high"
  },
  "acceptance": {
    "invariants": [
      3,
      10,
      11
    ],
    "instructions": "落实四库物理隔离：canon.db 只读、world.db 强事务、retrieval.db 幂等可重建。迁移变更需仲裁扩权。",
    "assertions": [
      "INV-03",
      "INV-10",
      "INV-11"
    ]
  }
}
