{
  "$schema": "contracts/engineering/task_capsule.schema.json",
  "capsule_id": "CAP-SB-14M",
  "capsule_revision": 1,
  "task_id": "SB-14M",
  "title": "更正线缆夹具来源的两处不实说明",
  "assigned_role": "AGT-MAC",
  "status": "CREATED",
  "created_at": "2026-10-02T08:47:50.390148+00:00",
  "risk_class": "medium",
  "base": {
    "target_ref": "origin/main",
    "base_sha": "3eab7b53a50b72178d9c0ad6db402ac33ad24b66",
    "target_sha": "3eab7b53a50b72178d9c0ad6db402ac33ad24b66",
    "context_snapshot": "sha256:9fbc6b5dcd044a5ed5e34c083876819fe94cd7ac99ea074cf57afb4bdcfb7358"
  },
  "scope": {
    "read": [
      "macos-app/",
      "contracts/",
      "docs/03_工程规范/",
      "engine/tests/"
    ],
    "write": [
      "macos-app/WorldOfMysteries/",
      "macos-app/WorldOfMysteriesTests/",
      "engine/tests/test_app_engine_session.py",
      "engine/tests/test_voice_turn_e2e.py",
      "engine/tests/fixtures/app_engine_driver.swift",
      "engine/tests/fixtures/voice_turn_e2e_driver.swift"
    ],
    "forbidden": [
      "engine/domain/**",
      "engine/infrastructure/**",
      "engine/ai/**",
      "engine/application/**",
      ".hacf/**",
      ".github/**"
    ],
    "privileged_grants": []
  },
  "context": {
    "core_manifest": [
      "symbol:CaptureSpec@macos-app/WorldOfMysteries/Tools/capture_component_gallery_runtime.py:67",
      "symbol:capture_plan@macos-app/WorldOfMysteries/Tools/capture_component_gallery_runtime.py:79",
      "symbol:run@macos-app/WorldOfMysteries/Tools/capture_component_gallery_runtime.py:92",
      "symbol:write_preferences@macos-app/WorldOfMysteries/Tools/capture_component_gallery_runtime.py:96",
      "symbol:clear_preferences@macos-app/WorldOfMysteries/Tools/capture_component_gallery_runtime.py:107",
      "symbol:windows_for_pid@macos-app/WorldOfMysteries/Tools/capture_component_gallery_runtime.py:112",
      "symbol:primary_window@macos-app/WorldOfMysteries/Tools/capture_component_gallery_runtime.py:122",
      "symbol:parse_args@macos-app/WorldOfMysteries/Tools/capture_component_gallery_runtime.py:147",
      "symbol:main@macos-app/WorldOfMysteries/Tools/capture_component_gallery_runtime.py:156",
      "symbol:filename@macos-app/WorldOfMysteries/Tools/capture_component_gallery_runtime.py:73",
      "symbol:child_environment@engine/tests/test_app_engine_session.py:71",
      "symbol:_engine_ipc_referenced_sources@engine/tests/test_app_engine_session.py:86",
      "symbol:test_driver_sources_cover_engine_ipc_top_level_type_dependencies@engine/tests/test_app_engine_session.py:104",
      "symbol:test_package_probe_sources_cover_engine_ipc_top_level_type_dependencies@engine/tests/test_app_engine_session.py:115",
      "symbol:app_driver@engine/tests/test_app_engine_session.py:139",
      "symbol:test_real_swift_app_engine_lifecycle@engine/tests/test_app_engine_session.py:175",
      "symbol:test_engine_stops_when_swift_parent_is_force_quit@engine/tests/test_app_engine_session.py:184",
      "symbol:_receive@engine/tests/test_app_engine_session.py:218",
      "symbol:_frame@engine/tests/test_app_engine_session.py:230",
      "symbol:test_production_client_rejects_bad_peers@engine/tests/test_app_engine_session.py:237",
      "symbol:story_engine@engine/tests/test_app_engine_session.py:375",
      "symbol:_run_story@engine/tests/test_app_engine_session.py:416",
      "symbol:_facts@engine/tests/test_app_engine_session.py:435",
      "symbol:_fired_stages@engine/tests/test_app_engine_session.py:444",
      "symbol:_world_counts@engine/tests/test_app_engine_session.py:458",
      "symbol:story_session@engine/tests/test_app_engine_session.py:474",
      "symbol:test_real_story_first_turn_reopens_across_processes@engine/tests/test_app_engine_session.py:489",
      "symbol:test_real_story_five_turns_commit_settle_and_close@engine/tests/test_app_engine_session.py:529",
      "symbol:test_real_story_lost_ack_recovers_without_recommitting@engine/tests/test_app_engine_session.py:580",
      "symbol:test_real_story_pending_request_waits_for_explicit_continuation@engine/tests/test_app_engine_session.py:600"
    ],
    "related_contracts": [
      "engine_ipc.schema.json",
      "narrative_block.schema.json"
    ],
    "slice_strategy": "focus-unmatched(static-scope-order)",
    "token_estimate": 870,
    "max_core_tokens": 3000,
    "expansion_policy": "arbiter_approved",
    "note": "上下文为最小充分集而非最小集：不足时可申请扩权/扩上下文并生成胶囊修订版。"
  },
  "impact": {
    "symbols": [
      "CaptureSpec",
      "capture_plan",
      "run",
      "write_preferences",
      "clear_preferences",
      "windows_for_pid",
      "primary_window",
      "parse_args",
      "main",
      "filename",
      "child_environment",
      "_engine_ipc_referenced_sources",
      "test_driver_sources_cover_engine_ipc_top_level_type_dependencies",
      "test_package_probe_sources_cover_engine_ipc_top_level_type_dependencies",
      "app_driver",
      "test_real_swift_app_engine_lifecycle",
      "test_engine_stops_when_swift_parent_is_force_quit",
      "_receive",
      "_frame",
      "test_production_client_rejects_bad_peers",
      "story_engine",
      "_run_story",
      "_facts",
      "_fired_stages",
      "_world_counts",
      "story_session",
      "test_real_story_first_turn_reopens_across_processes",
      "test_real_story_five_turns_commit_settle_and_close",
      "test_real_story_lost_ack_recovers_without_recommitting",
      "test_real_story_pending_request_waits_for_explicit_continuation"
    ],
    "contracts": [
      "engine_ipc.schema.json",
      "narrative_block.schema.json"
    ],
    "tests": []
  },
  "dependencies": {
    "depends_on": [],
    "conflicts_with": []
  },
  "gates": {
    "profile": "MACOS_APP_P0",
    "profile_digest": "sha256:7de7135b5f5fbc8caf808b12c134028c9390b69a554abdc449019b1bde671893",
    "profile_file": ".hacf/gates/macos_app_p0.json",
    "risk_class": "medium"
  },
  "acceptance": {
    "invariants": [
      12
    ],
    "instructions": "遵循 Swift 6 严格并发与 SwiftUI @Observable 规范，严格通过 UDS IPC 驱动，零直接数据库访问。",
    "assertions": [
      "INV-12"
    ]
  }
}
