{
  "$schema": "contracts/engineering/task_capsule.schema.json",
  "capsule_id": "CAP-VOICE-V01-SWIFT-MEDIA",
  "capsule_revision": 1,
  "task_id": "VOICE-V01-SWIFT-MEDIA",
  "title": "Voice V01 Swift media framing parity",
  "assigned_role": "AGT-MAC",
  "status": "CREATED",
  "created_at": "2026-09-19T03:16:52.669988+00:00",
  "risk_class": "medium",
  "base": {
    "target_ref": "origin/main",
    "base_sha": "0406d8e87c4176d1b503d786df96f11917bf06f3",
    "target_sha": "f720904c08fd754875fd320f9f615c17d215bf9f",
    "context_snapshot": "sha256:e69529b0c7423bd33effe96daba3977b2484d1913e274221c5b5cf784bbd8a64"
  },
  "scope": {
    "read": [
      "macos-app/",
      "contracts/",
      "docs/03_工程规范/"
    ],
    "write": [
      "macos-app/WorldOfMysteries/",
      "macos-app/WorldOfMysteriesTests/"
    ],
    "forbidden": [
      "engine/**",
      ".hacf/**",
      ".github/**"
    ],
    "privileged_grants": []
  },
  "context": {
    "core_manifest": [],
    "related_contracts": [
      "engine_ipc.schema.json",
      "narrative_block.schema.json"
    ],
    "slice_strategy": "empty",
    "token_estimate": 0,
    "max_core_tokens": 3000,
    "expansion_policy": "arbiter_approved",
    "note": "上下文为最小充分集而非最小集：不足时可申请扩权/扩上下文并生成胶囊修订版。"
  },
  "impact": {
    "symbols": [],
    "contracts": [
      "engine_ipc.schema.json",
      "narrative_block.schema.json"
    ],
    "tests": []
  },
  "dependencies": {
    "depends_on": [],
    "conflicts_with": []
  },
  "gates": {
    "profile": "MACOS_APP_P0",
    "profile_digest": "sha256:7de7135b5f5fbc8caf808b12c134028c9390b69a554abdc449019b1bde671893",
    "profile_file": ".hacf/gates/macos_app_p0.json",
    "risk_class": "medium"
  },
  "acceptance": {
    "invariants": [
      12
    ],
    "instructions": "遵循 Swift 6 严格并发与 SwiftUI @Observable 规范，严格通过 UDS IPC 驱动，零直接数据库访问。",
    "assertions": [
      "INV-12"
    ]
  }
}
