{
  "$schema": "contracts/engineering/task_capsule.schema.json",
  "capsule_id": "CAP-VF-14A",
  "capsule_revision": 1,
  "task_id": "VF-14A",
  "title": "供给任务的读取、取消与重试命令面",
  "assigned_role": "AGT-AI",
  "status": "CREATED",
  "created_at": "2026-09-29T22:53:26.668377+00:00",
  "risk_class": "high",
  "base": {
    "target_ref": "origin/main",
    "base_sha": "0fcc6936e26432eb3b09ccf9965238d9bb77faf1",
    "target_sha": "68b79c0b61e6f2044229d8d41ee291cfabb42373",
    "context_snapshot": "sha256:9a44321e2a04b7ea50da6479431035106dcae0bc95ead5a76a9a9c2f2c1d71a8"
  },
  "scope": {
    "read": [
      "engine/ai/",
      "engine/application/",
      "engine/tests/",
      "contracts/"
    ],
    "write": [
      "engine/ai/",
      "engine/application/",
      "engine/tests/",
      "engine/infrastructure/story_runtime.py",
      "engine/infrastructure/episode_settlement.py",
      "engine/infrastructure/scenarios/"
    ],
    "forbidden": [
      "macos-app/**",
      "engine/domain/**",
      "engine/infrastructure/database*",
      "engine/infrastructure/outbox*",
      "engine/infrastructure/migrations/",
      "engine/infrastructure/**/database*",
      "engine/infrastructure/**/outbox*",
      "engine/infrastructure/**/migrations/",
      ".hacf/**",
      ".github/**"
    ],
    "privileged_grants": []
  },
  "context": {
    "core_manifest": [
      "symbol:AgentScopeAdapterProtocol@engine/ai/agentscope_adapter.py:23",
      "symbol:PreparedAgentScopeAdapter@engine/ai/agentscope_adapter.py:27",
      "symbol:send@engine/ai/agentscope_adapter.py:24",
      "symbol:__init__@engine/ai/agentscope_adapter.py:28",
      "symbol:send@engine/ai/agentscope_adapter.py:32",
      "symbol:constrain_output_schema@engine/ai/authorized_live_execution.py:64",
      "symbol:AuthorizedExecutionBudget@engine/ai/authorized_live_execution.py:108",
      "symbol:AuthorizedProposalResult@engine/ai/authorized_live_execution.py:136",
      "symbol:AuthorizedLiveExecution@engine/ai/authorized_live_execution.py:152",
      "symbol:__post_init__@engine/ai/authorized_live_execution.py:116",
      "symbol:proposal@engine/ai/authorized_live_execution.py:146",
      "symbol:__init__@engine/ai/authorized_live_execution.py:155",
      "symbol:execute@engine/ai/authorized_live_execution.py:180",
      "symbol:_execute@engine/ai/authorized_live_execution.py:213",
      "symbol:_compile_fresh@engine/ai/authorized_live_execution.py:355",
      "symbol:_validator@engine/ai/authorized_live_execution.py:368",
      "symbol:reject_external_refs@engine/ai/authorized_live_execution.py:377",
      "symbol:CacheUsage@engine/ai/cache_metrics.py:9",
      "symbol:normalize_usage@engine/ai/cache_metrics.py:23",
      "symbol:aggregate_hit_rate@engine/ai/cache_metrics.py:68",
      "symbol:hit_rate@engine/ai/cache_metrics.py:17",
      "symbol:number@engine/ai/cache_metrics.py:28",
      "symbol:GameplayCacheDecision@engine/ai/gameplay_cache.py:16",
      "symbol:GameplayCachePlanner@engine/ai/gameplay_cache.py:24",
      "symbol:GameplayAIGateway@engine/ai/gameplay_cache.py:55",
      "symbol:decide@engine/ai/gameplay_cache.py:31",
      "symbol:__init__@engine/ai/gameplay_cache.py:57",
      "symbol:execute@engine/ai/gameplay_cache.py:63",
      "symbol:TokenCount@engine/ai/gateway.py:23",
      "symbol:ModelReply@engine/ai/gateway.py:29"
    ],
    "related_contracts": [
      "context_packet.schema.json",
      "context_request.schema.json",
      "proposal.schema.json"
    ],
    "slice_strategy": "focus-unmatched(static-scope-order)",
    "token_estimate": 654,
    "max_core_tokens": 3000,
    "expansion_policy": "arbiter_approved",
    "note": "上下文为最小充分集而非最小集：不足时可申请扩权/扩上下文并生成胶囊修订版。"
  },
  "impact": {
    "symbols": [
      "AgentScopeAdapterProtocol",
      "PreparedAgentScopeAdapter",
      "send",
      "__init__",
      "send",
      "constrain_output_schema",
      "AuthorizedExecutionBudget",
      "AuthorizedProposalResult",
      "AuthorizedLiveExecution",
      "__post_init__",
      "proposal",
      "__init__",
      "execute",
      "_execute",
      "_compile_fresh",
      "_validator",
      "reject_external_refs",
      "CacheUsage",
      "normalize_usage",
      "aggregate_hit_rate",
      "hit_rate",
      "number",
      "GameplayCacheDecision",
      "GameplayCachePlanner",
      "GameplayAIGateway",
      "decide",
      "__init__",
      "execute",
      "TokenCount",
      "ModelReply"
    ],
    "contracts": [
      "context_packet.schema.json",
      "context_request.schema.json",
      "proposal.schema.json"
    ],
    "tests": []
  },
  "dependencies": {
    "depends_on": [],
    "conflicts_with": []
  },
  "gates": {
    "profile": "AI_GATEWAY_P0",
    "profile_digest": "sha256:afd00e18003069ea384a524153feb08b15be7dad74a0d641493bf93653e8694c",
    "profile_file": ".hacf/gates/ai_gateway_p0.json",
    "risk_class": "high"
  },
  "acceptance": {
    "invariants": [
      5,
      6,
      7,
      8
    ],
    "instructions": "AI 仅产出类型化 Proposal；语义授权先行，严禁直接执行写库事务。",
    "assertions": [
      "INV-05",
      "INV-06",
      "INV-07",
      "INV-08"
    ]
  }
}
