{
  "$schema": "contracts/engineering/task_capsule.schema.json",
  "capsule_id": "CAP-VF-04B",
  "capsule_revision": 1,
  "task_id": "VF-04B",
  "title": "Seal admitted evidence into the render path",
  "assigned_role": "AGT-AI",
  "status": "CREATED",
  "created_at": "2026-09-29T16:49:09.663841+00:00",
  "risk_class": "high",
  "base": {
    "target_ref": "main",
    "base_sha": "85540d31288c1f3515e3d4b77e63196cb962640e",
    "target_sha": "85540d31288c1f3515e3d4b77e63196cb962640e",
    "context_snapshot": "sha256:a401c0f288c6c34e9ff05b1aaa9083e12f74d521212566b695181eee3fa969e8"
  },
  "scope": {
    "read": [
      "engine/ai/",
      "engine/application/",
      "engine/tests/",
      "contracts/"
    ],
    "write": [
      "engine/ai/",
      "engine/application/",
      "engine/tests/",
      "engine/infrastructure/story_runtime.py",
      "engine/infrastructure/episode_settlement.py",
      "engine/infrastructure/scenarios/"
    ],
    "forbidden": [
      "macos-app/**",
      "engine/domain/**",
      "engine/infrastructure/database*",
      "engine/infrastructure/outbox*",
      "engine/infrastructure/migrations/",
      "engine/infrastructure/**/database*",
      "engine/infrastructure/**/outbox*",
      "engine/infrastructure/**/migrations/",
      ".hacf/**",
      ".github/**"
    ],
    "privileged_grants": []
  },
  "context": {
    "core_manifest": [
      "symbol:SpeechUnitSealingError@engine/application/speech_unit.py:42",
      "symbol:VoiceBindingReadPort@engine/application/speech_unit.py:50",
      "symbol:_digest@engine/application/speech_unit.py:54",
      "symbol:_desired_payload@engine/application/speech_unit.py:65",
      "symbol:_performance_payload@engine/application/speech_unit.py:85",
      "symbol:SealedSpeechUnit@engine/application/speech_unit.py:99",
      "symbol:SpeechUnitSealingService@engine/application/speech_unit.py:163",
      "symbol:__init__@engine/application/speech_unit.py:45",
      "symbol:load_scope@engine/application/speech_unit.py:51",
      "symbol:sealed@engine/application/speech_unit.py:132",
      "symbol:render_recipe@engine/application/speech_unit.py:135",
      "symbol:__init__@engine/application/speech_unit.py:166",
      "symbol:seal@engine/application/speech_unit.py:181",
      "symbol:VoiceEvidenceGate@engine/application/voice_evidence.py:124",
      "symbol:_sealed_unit_codec_fixture@engine/tests/test_audio_adapter.py:2068",
      "symbol:_repack_sealed_unit_payload@engine/tests/test_audio_adapter.py:2140",
      "symbol:test_sealed_unit_codec_round_trips_every_typed_field@engine/tests/test_audio_adapter.py:2159",
      "symbol:test_sealed_unit_codec_round_trips_nullable_model_revision@engine/tests/test_audio_adapter.py:2188",
      "symbol:test_sealed_unit_codec_rejects_digest_and_source_identity_mismatch@engine/tests/test_audio_adapter.py:2210",
      "symbol:test_sealed_unit_codec_rejects_unknown_format_version@engine/tests/test_audio_adapter.py:2227",
      "symbol:test_sealed_unit_codec_rejects_the_pre_evidence_format_version@engine/tests/test_audio_adapter.py:2241",
      "symbol:test_sealed_unit_codec_rejects_a_partially_pinned_evidence_identity@engine/tests/test_audio_adapter.py:2258",
      "symbol:test_sealed_unit_codec_rejects_pickle_bytes_reduce_and_unknown_keys@engine/tests/test_audio_adapter.py:2277",
      "symbol:test_sealed_unit_codec_rejects_credentials_and_oversized_content@engine/tests/test_audio_adapter.py:2308",
      "symbol:test_sealed_unit_codec_republishes_the_same_unit_after_registry_expiry@engine/tests/test_audio_adapter.py:2358",
      "symbol:test_prefetch_recipe_uses_only_sealed_dry_execution_identity@engine/tests/test_audio_prefetch.py:115",
      "symbol:test_unverified_model_or_unsealed_input_is_rejected_before_render@engine/tests/test_audio_prefetch.py:132",
      "symbol:test_render_recipe_accepts_protocol_max_spoken_text_and_rejects_oversize@engine/tests/test_audio_take_store.py:307",
      "symbol:_store_sealed_result@engine/tests/test_post_commit_control.py:113",
      "symbol:sealed_unit@engine/tests/test_post_commit_control.py:138"
    ],
    "related_contracts": [
      "context_packet.schema.json",
      "context_request.schema.json",
      "proposal.schema.json"
    ],
    "slice_strategy": "focus-ranked",
    "token_estimate": 837,
    "max_core_tokens": 3000,
    "expansion_policy": "arbiter_approved",
    "note": "上下文为最小充分集而非最小集：不足时可申请扩权/扩上下文并生成胶囊修订版。"
  },
  "impact": {
    "symbols": [
      "SpeechUnitSealingError",
      "VoiceBindingReadPort",
      "_digest",
      "_desired_payload",
      "_performance_payload",
      "SealedSpeechUnit",
      "SpeechUnitSealingService",
      "__init__",
      "load_scope",
      "sealed",
      "render_recipe",
      "__init__",
      "seal",
      "VoiceEvidenceGate",
      "_sealed_unit_codec_fixture",
      "_repack_sealed_unit_payload",
      "test_sealed_unit_codec_round_trips_every_typed_field",
      "test_sealed_unit_codec_round_trips_nullable_model_revision",
      "test_sealed_unit_codec_rejects_digest_and_source_identity_mismatch",
      "test_sealed_unit_codec_rejects_unknown_format_version",
      "test_sealed_unit_codec_rejects_the_pre_evidence_format_version",
      "test_sealed_unit_codec_rejects_a_partially_pinned_evidence_identity",
      "test_sealed_unit_codec_rejects_pickle_bytes_reduce_and_unknown_keys",
      "test_sealed_unit_codec_rejects_credentials_and_oversized_content",
      "test_sealed_unit_codec_republishes_the_same_unit_after_registry_expiry",
      "test_prefetch_recipe_uses_only_sealed_dry_execution_identity",
      "test_unverified_model_or_unsealed_input_is_rejected_before_render",
      "test_render_recipe_accepts_protocol_max_spoken_text_and_rejects_oversize",
      "_store_sealed_result",
      "sealed_unit"
    ],
    "contracts": [
      "context_packet.schema.json",
      "context_request.schema.json",
      "proposal.schema.json"
    ],
    "tests": []
  },
  "dependencies": {
    "depends_on": [],
    "conflicts_with": []
  },
  "gates": {
    "profile": "AI_GATEWAY_P0",
    "profile_digest": "sha256:afd00e18003069ea384a524153feb08b15be7dad74a0d641493bf93653e8694c",
    "profile_file": ".hacf/gates/ai_gateway_p0.json",
    "risk_class": "high"
  },
  "acceptance": {
    "invariants": [
      5,
      6,
      7,
      8
    ],
    "instructions": "AI 仅产出类型化 Proposal；语义授权先行，严禁直接执行写库事务。",
    "assertions": [
      "INV-05",
      "INV-06",
      "INV-07",
      "INV-08"
    ]
  }
}
