{
  "$schema": "contracts/engineering/task_capsule.schema.json",
  "capsule_id": "CAP-B-GOLDEN-ASSERTIONS",
  "capsule_revision": 1,
  "task_id": "B-GOLDEN-ASSERTIONS",
  "title": "落实 Golden 五轮断言与故障恢复准备",
  "assigned_role": "AGT-QA",
  "status": "CREATED",
  "created_at": "2026-09-27T01:29:35.471029+00:00",
  "risk_class": "high",
  "base": {
    "target_ref": "main",
    "base_sha": "416ebcdafdd91582253700881f031fd61fb84cd4",
    "target_sha": "416ebcdafdd91582253700881f031fd61fb84cd4",
    "context_snapshot": "sha256:46fcfc4d96f4e8b4480aa057d5a53fec8576950190d6a40ef90ee048ce922d26"
  },
  "scope": {
    "read": [
      "engine/",
      "macos-app/",
      "contracts/",
      "fixtures/",
      "docs/"
    ],
    "write": [
      "engine/tests/",
      "macos-app/WorldOfMysteriesTests/",
      "fixtures/golden_001/"
    ],
    "forbidden": [
      "engine/domain/**",
      "engine/application/**",
      "engine/ai/**",
      "engine/infrastructure/**",
      "macos-app/WorldOfMysteries/**",
      ".hacf/**",
      ".github/**"
    ],
    "privileged_grants": []
  },
  "context": {
    "core_manifest": [
      "symbol:test_all_golden_advice_action_beats_and_narrative_match_schema_and_python@engine/tests/test_contracts_pydantic.py:76",
      "symbol:test_all_golden_knowledge_matches_schema_and_python@engine/tests/test_contracts_pydantic.py:94",
      "symbol:test_golden_001_character_matches_schema@engine/tests/test_contracts_schema.py:58",
      "symbol:test_golden_001_world_matches_schema@engine/tests/test_contracts_schema.py:66",
      "symbol:test_golden_001_seed_matches_schema@engine/tests/test_contracts_schema.py:74",
      "symbol:test_golden_001_expected_episode_matches_schema@engine/tests/test_contracts_schema.py:82",
      "symbol:test_golden_001_knowledge_matches_schema@engine/tests/test_contracts_schema.py:90",
      "symbol:test_golden_001_turns_advice_matches_schema@engine/tests/test_contracts_schema.py:103",
      "symbol:_read@engine/tests/test_golden_first_turn.py:29",
      "symbol:_canonical_digest@engine/tests/test_golden_first_turn.py:33",
      "symbol:_bundle_payload@engine/tests/test_golden_first_turn.py:46",
      "symbol:Source@engine/tests/test_golden_first_turn.py:75",
      "symbol:_bootstrap@engine/tests/test_golden_first_turn.py:80",
      "symbol:_frozen@engine/tests/test_golden_first_turn.py:88",
      "symbol:test_interpreter_uses_only_frozen_semantic_template@engine/tests/test_golden_first_turn.py:104",
      "symbol:test_interpreter_rejects_any_other_text@engine/tests/test_golden_first_turn.py:118",
      "symbol:test_proposer_rebinds_identity_and_evidence_later@engine/tests/test_golden_first_turn.py:131",
      "symbol:load@engine/tests/test_golden_first_turn.py:76",
      "symbol:_read@engine/tests/test_golden_turn1_durable.py:25",
      "symbol:_initial_session@engine/tests/test_golden_turn1_durable.py:29",
      "symbol:_turn1_delta@engine/tests/test_golden_turn1_durable.py:77",
      "symbol:_validated_turn@engine/tests/test_golden_turn1_durable.py:104",
      "symbol:_open_database@engine/tests/test_golden_turn1_durable.py:122",
      "symbol:_rows@engine/tests/test_golden_turn1_durable.py:136",
      "symbol:test_golden_turn1_commit_survives_close_reopen_and_replay@engine/tests/test_golden_turn1_durable.py:141",
      "symbol:test_golden_turn1_after_explicit_open_matches_existing_expected_state@engine/tests/test_golden_turn1_durable.py:215",
      "symbol:test_unsupported_session_overlay_fails_before_any_commit@engine/tests/test_golden_turn1_durable.py:292",
      "symbol:test_failure_before_sqlite_commit_leaves_no_partial_story_rows@engine/tests/test_golden_turn1_durable.py:326",
      "symbol:fail@engine/tests/test_golden_turn1_durable.py:332",
      "symbol:_RecordingInterpreter@engine/tests/test_golden_voice_chain_durable.py:61"
    ],
    "related_contracts": [
      "episode.schema.json",
      "turn_transaction.schema.json",
      "engine_ipc.schema.json"
    ],
    "slice_strategy": "focus-ranked",
    "token_estimate": 838,
    "max_core_tokens": 3000,
    "expansion_policy": "arbiter_approved",
    "note": "上下文为最小充分集而非最小集：不足时可申请扩权/扩上下文并生成胶囊修订版。"
  },
  "impact": {
    "symbols": [
      "test_all_golden_advice_action_beats_and_narrative_match_schema_and_python",
      "test_all_golden_knowledge_matches_schema_and_python",
      "test_golden_001_character_matches_schema",
      "test_golden_001_world_matches_schema",
      "test_golden_001_seed_matches_schema",
      "test_golden_001_expected_episode_matches_schema",
      "test_golden_001_knowledge_matches_schema",
      "test_golden_001_turns_advice_matches_schema",
      "_read",
      "_canonical_digest",
      "_bundle_payload",
      "Source",
      "_bootstrap",
      "_frozen",
      "test_interpreter_uses_only_frozen_semantic_template",
      "test_interpreter_rejects_any_other_text",
      "test_proposer_rebinds_identity_and_evidence_later",
      "load",
      "_read",
      "_initial_session",
      "_turn1_delta",
      "_validated_turn",
      "_open_database",
      "_rows",
      "test_golden_turn1_commit_survives_close_reopen_and_replay",
      "test_golden_turn1_after_explicit_open_matches_existing_expected_state",
      "test_unsupported_session_overlay_fails_before_any_commit",
      "test_failure_before_sqlite_commit_leaves_no_partial_story_rows",
      "fail",
      "_RecordingInterpreter"
    ],
    "contracts": [
      "episode.schema.json",
      "turn_transaction.schema.json",
      "engine_ipc.schema.json"
    ],
    "tests": []
  },
  "dependencies": {
    "depends_on": [],
    "conflicts_with": []
  },
  "gates": {
    "profile": "FULL_P0",
    "profile_digest": "sha256:7aee88d64a790cf32dedf224fd100ce4d623c8a92a5f7ee06703783decccfee6",
    "profile_file": ".hacf/gates/full_p0.json",
    "risk_class": "high"
  },
  "acceptance": {
    "invariants": [
      1,
      2,
      3,
      4,
      5,
      6,
      7,
      8,
      9,
      10,
      11,
      12,
      13,
      14,
      15
    ],
    "instructions": "作为裁决者与质检门禁。只读实现、只写断言；严禁为通过测试而放宽黄金断言。",
    "assertions": [
      "INV-01",
      "INV-02",
      "INV-03",
      "INV-04",
      "INV-05",
      "INV-06",
      "INV-07",
      "INV-08",
      "INV-09",
      "INV-10",
      "INV-11",
      "INV-12",
      "INV-13",
      "INV-14",
      "INV-15"
    ]
  }
}
